{
  "kind": "historical-offline-pipeline-sample",
  "source_url": "https://raw.githubusercontent.com/hyperprophet/wikipedia-pageviews-2020/e1d61b4935d863ea7a2c83d9b010e56e2ffc5438/wikipedia_pageviews.csv",
  "source_sha256": "f9bc4774dcd1f50ba36efd8ce69057bafab6035358726fece0cb5e660ad71f9f",
  "source_license": "CC0-1.0",
  "project": "en.wikipedia",
  "access": "unrecorded-by-source",
  "agent": "unrecorded-by-source",
  "period_start": "2020-06-01",
  "period_end": "2020-06-30",
  "current_month_verified": false,
  "independent_verification": "not yet completed",
  "curation": "83 household-name candidates selected manually; 30 disjoint pairs closest to ratio 1.6 selected deterministically",
  "rows": [
    {
      "id": "historical-01",
      "a": {
        "article": "Arnold_Schwarzenegger",
        "pageviews": 540181,
        "daily": [
          {
            "date": "2020-06-01",
            "pageviews": 20481
          },
          {
            "date": "2020-06-02",
            "pageviews": 17167
          },
          {
            "date": "2020-06-03",
            "pageviews": 15350
          },
          {
            "date": "2020-06-04",
            "pageviews": 15899
          },
          {
            "date": "2020-06-05",
            "pageviews": 17070
          },
          {
            "date": "2020-06-06",
            "pageviews": 17761
          },
          {
            "date": "2020-06-07",
            "pageviews": 20946
          },
          {
            "date": "2020-06-08",
            "pageviews": 19634
          },
          {
            "date": "2020-06-09",
            "pageviews": 18063
          },
          {
            "date": "2020-06-10",
            "pageviews": 20613
          },
          {
            "date": "2020-06-11",
            "pageviews": 21756
          },
          {
            "date": "2020-06-12",
            "pageviews": 19997
          },
          {
            "date": "2020-06-13",
            "pageviews": 20751
          },
          {
            "date": "2020-06-14",
            "pageviews": 20031
          },
          {
            "date": "2020-06-15",
            "pageviews": 17394
          },
          {
            "date": "2020-06-16",
            "pageviews": 16149
          },
          {
            "date": "2020-06-17",
            "pageviews": 18111
          },
          {
            "date": "2020-06-18",
            "pageviews": 16412
          },
          {
            "date": "2020-06-19",
            "pageviews": 20533
          },
          {
            "date": "2020-06-20",
            "pageviews": 18369
          },
          {
            "date": "2020-06-21",
            "pageviews": 18910
          },
          {
            "date": "2020-06-22",
            "pageviews": 20334
          },
          {
            "date": "2020-06-23",
            "pageviews": 17411
          },
          {
            "date": "2020-06-24",
            "pageviews": 15767
          },
          {
            "date": "2020-06-25",
            "pageviews": 15162
          },
          {
            "date": "2020-06-26",
            "pageviews": 15490
          },
          {
            "date": "2020-06-27",
            "pageviews": 15919
          },
          {
            "date": "2020-06-28",
            "pageviews": 17156
          },
          {
            "date": "2020-06-29",
            "pageviews": 15956
          },
          {
            "date": "2020-06-30",
            "pageviews": 15589
          }
        ]
      },
      "b": {
        "article": "United_Kingdom",
        "pageviews": 863956,
        "daily": [
          {
            "date": "2020-06-01",
            "pageviews": 28454
          },
          {
            "date": "2020-06-02",
            "pageviews": 29011
          },
          {
            "date": "2020-06-03",
            "pageviews": 33906
          },
          {
            "date": "2020-06-04",
            "pageviews": 29938
          },
          {
            "date": "2020-06-05",
            "pageviews": 29852
          },
          {
            "date": "2020-06-06",
            "pageviews": 28398
          },
          {
            "date": "2020-06-07",
            "pageviews": 30111
          },
          {
            "date": "2020-06-08",
            "pageviews": 31354
          },
          {
            "date": "2020-06-09",
            "pageviews": 30616
          },
          {
            "date": "2020-06-10",
            "pageviews": 30999
          },
          {
            "date": "2020-06-11",
            "pageviews": 30164
          },
          {
            "date": "2020-06-12",
            "pageviews": 29470
          },
          {
            "date": "2020-06-13",
            "pageviews": 31146
          },
          {
            "date": "2020-06-14",
            "pageviews": 30231
          },
          {
            "date": "2020-06-15",
            "pageviews": 29125
          },
          {
            "date": "2020-06-16",
            "pageviews": 28703
          },
          {
            "date": "2020-06-17",
            "pageviews": 28393
          },
          {
            "date": "2020-06-18",
            "pageviews": 29938
          },
          {
            "date": "2020-06-19",
            "pageviews": 28842
          },
          {
            "date": "2020-06-20",
            "pageviews": 25657
          },
          {
            "date": "2020-06-21",
            "pageviews": 26033
          },
          {
            "date": "2020-06-22",
            "pageviews": 27434
          },
          {
            "date": "2020-06-23",
            "pageviews": 27075
          },
          {
            "date": "2020-06-24",
            "pageviews": 26188
          },
          {
            "date": "2020-06-25",
            "pageviews": 26276
          },
          {
            "date": "2020-06-26",
            "pageviews": 27259
          },
          {
            "date": "2020-06-27",
            "pageviews": 26733
          },
          {
            "date": "2020-06-28",
            "pageviews": 27386
          },
          {
            "date": "2020-06-29",
            "pageviews": 28172
          },
          {
            "date": "2020-06-30",
            "pageviews": 27092
          }
        ]
      }
    },
    {
      "id": "historical-02",
      "a": {
        "article": "Scarlett_Johansson",
        "pageviews": 532928,
        "daily": [
          {
            "date": "2020-06-01",
            "pageviews": 19109
          },
          {
            "date": "2020-06-02",
            "pageviews": 17613
          },
          {
            "date": "2020-06-03",
            "pageviews": 16969
          },
          {
            "date": "2020-06-04",
            "pageviews": 16276
          },
          {
            "date": "2020-06-05",
            "pageviews": 16760
          },
          {
            "date": "2020-06-06",
            "pageviews": 19966
          },
          {
            "date": "2020-06-07",
            "pageviews": 21993
          },
          {
            "date": "2020-06-08",
            "pageviews": 18715
          },
          {
            "date": "2020-06-09",
            "pageviews": 16733
          },
          {
            "date": "2020-06-10",
            "pageviews": 16794
          },
          {
            "date": "2020-06-11",
            "pageviews": 17691
          },
          {
            "date": "2020-06-12",
            "pageviews": 16556
          },
          {
            "date": "2020-06-13",
            "pageviews": 20373
          },
          {
            "date": "2020-06-14",
            "pageviews": 21425
          },
          {
            "date": "2020-06-15",
            "pageviews": 17221
          },
          {
            "date": "2020-06-16",
            "pageviews": 16407
          },
          {
            "date": "2020-06-17",
            "pageviews": 17224
          },
          {
            "date": "2020-06-18",
            "pageviews": 16820
          },
          {
            "date": "2020-06-19",
            "pageviews": 17374
          },
          {
            "date": "2020-06-20",
            "pageviews": 19689
          },
          {
            "date": "2020-06-21",
            "pageviews": 20733
          },
          {
            "date": "2020-06-22",
            "pageviews": 17461
          },
          {
            "date": "2020-06-23",
            "pageviews": 14933
          },
          {
            "date": "2020-06-24",
            "pageviews": 15019
          },
          {
            "date": "2020-06-25",
            "pageviews": 14437
          },
          {
            "date": "2020-06-26",
            "pageviews": 14506
          },
          {
            "date": "2020-06-27",
            "pageviews": 17598
          },
          {
            "date": "2020-06-28",
            "pageviews": 22181
          },
          {
            "date": "2020-06-29",
            "pageviews": 18324
          },
          {
            "date": "2020-06-30",
            "pageviews": 16028
          }
        ]
      },
      "b": {
        "article": "Abraham_Lincoln",
        "pageviews": 853675,
        "daily": [
          {
            "date": "2020-06-01",
            "pageviews": 24732
          },
          {
            "date": "2020-06-02",
            "pageviews": 28035
          },
          {
            "date": "2020-06-03",
            "pageviews": 32837
          },
          {
            "date": "2020-06-04",
            "pageviews": 28748
          },
          {
            "date": "2020-06-05",
            "pageviews": 26069
          },
          {
            "date": "2020-06-06",
            "pageviews": 28124
          },
          {
            "date": "2020-06-07",
            "pageviews": 31103
          },
          {